 use 24mca22;
Reading table information for completion of table and column names
You can turn off this feature to get a quicker startup with -A

Database changed
mysql> select * dtudents;
ERROR 1064 (42000): You have an error in your SQL syntax; check the manual that corresponds to your MySQL server version for the right syntax to use near 'dtudents' at line 1
mysql> select * students;
ERROR 1064 (42000): You have an error in your SQL syntax; check the manual that corresponds to your MySQL server version for the right syntax to use near 'students' at line 1
mysql> select * from  students;
Empty set (0.00 sec)

mysql> desc students;
+-----------+--------------+------+-----+---------+-------+
| Field     | Type         | Null | Key | Default | Extra |
+-----------+--------------+------+-----+---------+-------+
| studentid | int          | NO   | PRI | NULL    |       |
| name      | varchar(100) | NO   |     | NULL    |       |
| age       | int          | YES  |     | NULL    |       |
| dno       | int          | YES  | MUL | NULL    |       |
+-----------+--------------+------+-----+---------+-------+
4 rows in set (0.00 sec)

mysql> insert into student values(1,'naadhi',18,'mca'),(1,'naadhi',18,'mca'),
    -> select * students;^C

^C
mysql> insert into student values(1,'naadhi',18,'mca'),(2,'jal',17,'mca');
ERROR 1136 (21S01): Column count doesn't match value count at row 1
mysql> insert into students values(1,'naadhi',18,'mca'),(2,'jal',17,'mca');
ERROR 1366 (HY000): Incorrect integer value: 'mca' for column 'dno' at row 1
mysql> insert into students values(1,'naadhi',18,1),(2,'jal',17,1);
ERROR 3819 (HY000): Check constraint 'students_chk_1' is violated.
mysql> insert into students values(1,'naadhi',18,1),(2,'jal',17,1);
ERROR 3819 (HY000): Check constraint 'students_chk_1' is violated.
mysql> insert into students values(101,'naadhi',18,1),(102,'jal',17,1);
ERROR 3819 (HY000): Check constraint 'students_chk_1' is violated.
mysql> insert into students values(101,'naadhi',23,1),(102,'jal',22,1);
ERROR 1452 (23000): Cannot add or update a child row: a foreign key constraint fails (`24mca22`.`students`, CONSTRAINT `students_fkey_bookid` FOREIGN KEY (`dno`) REFERENCES `departments` (`dno`))
mysql> select *n from departments;
ERROR 1064 (42000): You have an error in your SQL syntax; check the manual that corresponds to your MySQL server version for the right syntax to use near 'n from departments' at line 1
mysql> select * from departments;
Empty set (0.00 sec)

mysql> desc departments;
+-------+-------------+------+-----+---------+-------+
| Field | Type        | Null | Key | Default | Extra |
+-------+-------------+------+-----+---------+-------+
| dno   | int         | NO   | PRI | NULL    |       |
| dname | varchar(50) | NO   |     | NULL    |       |
+-------+-------------+------+-----+---------+-------+
2 rows in set (0.00 sec)

mysql> insert into departments(1,'mca'),(2,'english');
ERROR 1064 (42000): You have an error in your SQL syntax; check the manual that corresponds to your MySQL server version for the right syntax to use near '1,'mca'),(2,'english')' at line 1
mysql> insert into departments values(1,'mca'),(2,'english');
Query OK, 2 rows affected (0.00 sec)
Records: 2  Duplicates: 0  Warnings: 0

mysql> insert into students values(101,'naadhi',23,1),(102,'jal',22,1);
Query OK, 2 rows affected (0.00 sec)
Records: 2  Duplicates: 0  Warnings: 0

mysql> insert into departments values(3,'btech'),(4,'mba');
Query OK, 2 rows affected (0.01 sec)
Records: 2  Duplicates: 0  Warnings: 0

mysql> insert into students values(103,'shahal',30,1),(104,'rani',22,1);
Query OK, 2 rows affected (0.00 sec)
Records: 2  Duplicates: 0  Warnings: 0

mysql> insert into students values(105,'raj',20,1),(106,'rahul',25,1);
ERROR 3819 (HY000): Check constraint 'students_chk_1' is violated.
mysql> insert into students values(105,'raj',24,1),(106,'rahul',25,1);
Query OK, 2 rows affected (0.01 sec)
Records: 2  Duplicates: 0  Warnings: 0

mysql> insert into students values(107,'sona',24,3),(106,'rahul',25,3);
ERROR 1062 (23000): Duplicate entry '106' for key 'students.PRIMARY'
mysql> insert into students values(107,'sona',24,3),(108,'rahul',25,3);
Query OK, 2 rows affected (0.01 sec)
Records: 2  Duplicates: 0  Warnings: 0

mysql> insert into students values(109,'suhana',29,3),(110,'minha',25,3);
Query OK, 2 rows affected (0.00 sec)
Records: 2  Duplicates: 0  Warnings: 0

mysql> insert into students values(111,'sunaina',29,3),(112,'munnavar',25,3);
Query OK, 2 rows affected (0.00 sec)
Records: 2  Duplicates: 0  Warnings: 0

mysql> desc books;
+--------+--------------+------+-----+---------+-------+
| Field  | Type         | Null | Key | Default | Extra |
+--------+--------------+------+-----+---------+-------+
| bookid | int          | NO   | PRI | NULL    |       |
| title  | varchar(100) | NO   |     | NULL    |       |
| author | varchar(50)  | NO   |     | NULL    |       |
| price  | int          | YES  |     | 100     |       |
+--------+--------------+------+-----+---------+-------+
4 rows in set (0.00 sec)

mysql> select * from books;
+--------+---------------------------+----------------+-------+
| bookid | title                     | author         | price |
+--------+---------------------------+----------------+-------+
|      1 | Database Systems          |  Ramez Elmasri |   550 |
|      2 | Operating System Concepts | Silberschatz   |   770 |
|      4 | Algorithms                |  Cormen        |   110 |
|      5 | wings of fire             | apj            |   700 |
+--------+---------------------------+----------------+-------+
4 rows in set (0.00 sec)

mysql> insert into books values(6,'diary of young girl','ann',600), insert into students values(1,'naadhi',18,1),(2,'jal',17,1);
 insert into students values(1,'naadhi',18,1),(2,'jal',17,1);
^C
mysql> insert into books values(6,'diary of young girl','ann',600),(6,'diary of young girl','ann',600),
    -> 

^C
mysql> nsert into books values(6,'diary of young girl','ann',600),(6,'diary of young girl','ann',600),
    -> 

^C
mysql> insert into books values(6,'diary of young girl','ann',600),(6,'diary of young girl','ann',600),
    -> 

^C
mysql> insert into books values(6,'diary of young girl','ann',600),(7,'discovery of india','nehru',700);
Query OK, 2 rows affected (0.00 sec)
Records: 2  Duplicates: 0  Warnings: 0

mysql> insert into books values(8,'oru deshathinte kadha','s.k.pottakad',1000),(9,'alchemist','paulo',1200);
Query OK, 2 rows affected (0.01 sec)
Records: 2  Duplicates: 0  Warnings: 0

mysql> select * from books;
+--------+---------------------------+----------------+-------+
| bookid | title                     | author         | price |
+--------+---------------------------+----------------+-------+
|      1 | Database Systems          |  Ramez Elmasri |   550 |
|      2 | Operating System Concepts | Silberschatz   |   770 |
|      4 | Algorithms                |  Cormen        |   110 |
|      5 | wings of fire             | apj            |   700 |
|      6 | diary of young girl       | ann            |   600 |
|      7 | discovery of india        | nehru          |   700 |
|      8 | oru deshathinte kadha     | s.k.pottakad   |  1000 |
|      9 | alchemist                 | paulo          |  1200 |
+--------+---------------------------+----------------+-------+
8 rows in set (0.00 sec)

mysql> desc bookissues;
+-------------+--------------+------+-----+---------+-------+
| Field       | Type         | Null | Key | Default | Extra |
+-------------+--------------+------+-----+---------+-------+
| bookid      | int          | NO   | PRI | NULL    |       |
| studentid   | int          | NO   | PRI | NULL    |       |
| issue_date  | date         | YES  |     | NULL    |       |
| return_date | date         | YES  |     | NULL    |       |
| fine        | decimal(5,2) | YES  |     | 0.00    |       |
+-------------+--------------+------+-----+---------+-------+
5 rows in set (0.00 sec)

mysql> insert into bookissues values (1,101,2025-8-2,2025-8-8,500);
ERROR 1292 (22007): Incorrect date value: '2015' for column 'issue_date' at row 1
mysql> insert into bookissues values (1,101,'2025-8-2','2025-8-8',500);
Query OK, 1 row affected (0.00 sec)

mysql> insert into bookissues values (1,101,'2025-8-2','2025-8-8',500);
ERROR 1062 (23000): Duplicate entry '1-101' for key 'bookissues.PRIMARY'
mysql> insert into bookissues values (1,101,'2025-8-2','2025-8-8',500);
ERROR 1062 (23000): Duplicate entry '1-101' for key 'bookissues.PRIMARY'
mysql> insert into bookissues values (1,101,'2025-8-2','2025-8-8',500);
ERROR 1062 (23000): Duplicate entry '1-101' for key 'bookissues.PRIMARY'
mysql> insert into bookissues values (1,101,2025-9-3,2025-9-4,0);
ERROR 1292 (22007): Incorrect date value: '2013' for column 'issue_date' at row 1
mysql> insert into bookissues values (2,102,'2025-9-3','2025-9-4',0);
Query OK, 1 row affected (0.01 sec)

mysql> insert into bookissues values (3,103,'2025-10-3','2025-10-25');
ERROR 1136 (21S01): Column count doesn't match value count at row 1
mysql> insert into bookissues values (3,103,'2025-10-3','2025-10-25',0);
ERROR 1452 (23000): Cannot add or update a child row: a foreign key constraint fails (`24mca22`.`bookissues`, CONSTRAINT `fkey_bookid` FOREIGN KEY (`bookid`) REFERENCES `books` (`bookid`))
mysql> insert into bookissues values (3,104,'2025-10-3','2025-10-25',0);
ERROR 1452 (23000): Cannot add or update a child row: a foreign key constraint fails (`24mca22`.`bookissues`, CONSTRAINT `fkey_bookid` FOREIGN KEY (`bookid`) REFERENCES `books` (`bookid`))
mysql> insert into bookissues values (4,104,'2025-10-3','2025-10-25',0);
Query OK, 1 row affected (0.00 sec)

mysql> insert into bookissues values (4,105,'2025-11-8','2025-12-12',0);
Query OK, 1 row affected (0.00 sec)

mysql> insert into bookissues values (5,106,'2025-1-7','2025-1-9',0);
Query OK, 1 row affected (0.01 sec)

mysql> insert into bookissues values (6,110,'2025-2-3','2025-9-26',0);
Query OK, 1 row affected (0.00 sec)

mysql> insert into bookissues values (7,109,'2025-4-5','2025-4-6',0);
Query OK, 1 row affected (0.01 sec)

mysql> insert into bookissues values (8,107,'2025-5-5','2025-4-22',0);
Query OK, 1 row affected (0.01 sec)

mysql> insert into bookissues(bookid,studentid,issue_date,return_date) values (7,107,'2025-1-35');1
ERROR 1136 (21S01): Column count doesn't match value count at row 1
ERROR 1064 (42000): You have an error in your SQL syntax; check the manual that corresponds to your MySQL server version for the right syntax to use near '100)' at line 1
mysql> insert into bookissues(bookid,studentid,issue_date,fine) values (7,107,'2025-1-35',100);
ERROR 1292 (22007): Incorrect date value: '2025-1-35' for column 'issue_date' at row 1
mysql> insert into bookissues(bookid,studentid,issue_date,fine) values (7,107,'2025-1-25',100);
Query OK, 1 row affected (0.01 sec)

mysql> select * from bookissues;
+--------+-----------+------------+-------------+--------+
| bookid | studentid | issue_date | return_date | fine   |
+--------+-----------+------------+-------------+--------+
|      1 |       101 | 2025-08-02 | 2025-08-08  | 500.00 |
|      2 |       102 | 2025-09-03 | 2025-09-04  |   0.00 |
|      4 |       104 | 2025-10-03 | 2025-10-25  |   0.00 |
|      4 |       105 | 2025-11-08 | 2025-12-12  |   0.00 |
|      5 |       106 | 2025-01-07 | 2025-01-09  |   0.00 |
|      6 |       110 | 2025-02-03 | 2025-09-26  |   0.00 |
|      7 |       107 | 2025-01-25 | NULL        | 100.00 |
|      7 |       109 | 2025-04-05 | 2025-04-06  |   0.00 |
|      8 |       107 | 2025-05-05 | 2025-04-22  |   0.00 |
+--------+-----------+------------+-------------+--------+
9 rows in set (0.00 sec)

mysql> update table bookissues set fine=0 where bookid=1;
ERROR 1064 (42000): You have an error in your SQL syntax; check the manual that corresponds to your MySQL server version for the right syntax to use near 'table bookissues set fine=0 where bookid=1' at line 1
mysql> update table bookissues set fine=NULL where bookid=1;
ERROR 1064 (42000): You have an error in your SQL syntax; check the manual that corresponds to your MySQL server version for the right syntax to use near 'table bookissues set fine=NULL where bookid=1' at line 1
mysql> update table bookissues set fine='0' where bookid='1';
ERROR 1064 (42000): You have an error in your SQL syntax; check the manual that corresponds to your MySQL server version for the right syntax to use near 'table bookissues set fine='0' where bookid='1'' at line 1
mysql> update  bookissues set fine='0' where bookid='1';
Query OK, 1 row affected (0.00 sec)
Rows matched: 1  Changed: 1  Warnings: 0

mysql> select * from bookissues;
+--------+-----------+------------+-------------+--------+
| bookid | studentid | issue_date | return_date | fine   |
+--------+-----------+------------+-------------+--------+
|      1 |       101 | 2025-08-02 | 2025-08-08  |   0.00 |
|      2 |       102 | 2025-09-03 | 2025-09-04  |   0.00 |
|      4 |       104 | 2025-10-03 | 2025-10-25  |   0.00 |
|      4 |       105 | 2025-11-08 | 2025-12-12  |   0.00 |
|      5 |       106 | 2025-01-07 | 2025-01-09  |   0.00 |
|      6 |       110 | 2025-02-03 | 2025-09-26  |   0.00 |
|      7 |       107 | 2025-01-25 | NULL        | 100.00 |
|      7 |       109 | 2025-04-05 | 2025-04-06  |   0.00 |
|      8 |       107 | 2025-05-05 | 2025-04-22  |   0.00 |
+--------+-----------+------------+-------------+--------+
9 rows in set (0.00 sec)

mysql> select count(*) as totalstudent from students group by dno;
+--------------+
| totalstudent |
+--------------+
|            6 |
|            6 |
+--------------+
2 rows in set (0.00 sec)

mysql> select * from students;
+-----------+----------+------+------+
| studentid | name     | age  | dno  |
+-----------+----------+------+------+
|       101 | naadhi   |   23 |    1 |
|       102 | jal      |   22 |    1 |
|       103 | shahal   |   30 |    1 |
|       104 | rani     |   22 |    1 |
|       105 | raj      |   24 |    1 |
|       106 | rahul    |   25 |    1 |
|       107 | sona     |   24 |    3 |
|       108 | rahul    |   25 |    3 |
|       109 | suhana   |   29 |    3 |
|       110 | minha    |   25 |    3 |
|       111 | sunaina  |   29 |    3 |
|       112 | munnavar |   25 |    3 |
+-----------+----------+------+------+
12 rows in set (0.00 sec)

mysql> select count(*) from stuents grup by studentid;
ERROR 1064 (42000): You have an error in your SQL syntax; check the manual that corresponds to your MySQL server version for the right syntax to use near 'by studentid' at line 1
mysql> select count(*) from stuents group by studentid;
ERROR 1146 (42S02): Table '24mca22.stuents' doesn't exist
mysql> select count(*) from students group by studentid;
+----------+
| count(*) |
+----------+
|        1 |
|        1 |
|        1 |
|        1 |
|        1 |
|        1 |
|        1 |
|        1 |
|        1 |
|        1 |
|        1 |
|        1 |
+----------+
12 rows in set (0.00 sec)

mysql> select sum(*) from students group by studentid;
ERROR 1064 (42000): You have an error in your SQL syntax; check the manual that corresponds to your MySQL server version for the right syntax to use near '*) from students group by studentid' at line 1
mysql> select sum(studentid) from students group by studentid;
+----------------+
| sum(studentid) |
+----------------+
|            101 |
|            102 |
|            103 |
|            104 |
|            105 |
|            106 |
|            107 |
|            108 |
|            109 |
|            110 |
|            111 |
|            112 |
+----------------+
12 rows in set (0.00 sec)

mysql> select sum() from students group by studentid;
ERROR 1064 (42000): You have an error in your SQL syntax; check the manual that corresponds to your MySQL server version for the right syntax to use near ') from students group by studentid' at line 1
mysql> select sum(*) from students group by studentid;
ERROR 1064 (42000): You have an error in your SQL syntax; check the manual that corresponds to your MySQL server version for the right syntax to use near '*) from students group by studentid' at line 1
mysql> select sum() from students ;
ERROR 1064 (42000): You have an error in your SQL syntax; check the manual that corresponds to your MySQL server version for the right syntax to use near ') from students' at line 1
mysql> select sum(*) from students ;
ERROR 1064 (42000): You have an error in your SQL syntax; check the manual that corresponds to your MySQL server version for the right syntax to use near '*) from students' at line 1
mysql> select count(studentid) from students;
+------------------+
| count(studentid) |
+------------------+
|               12 |
+------------------+
1 row in set (0.00 sec)

mysql> select * from students;
+-----------+----------+------+------+
| studentid | name     | age  | dno  |
+-----------+----------+------+------+
|       101 | naadhi   |   23 |    1 |
|       102 | jal      |   22 |    1 |
|       103 | shahal   |   30 |    1 |
|       104 | rani     |   22 |    1 |
|       105 | raj      |   24 |    1 |
|       106 | rahul    |   25 |    1 |
|       107 | sona     |   24 |    3 |
|       108 | rahul    |   25 |    3 |
|       109 | suhana   |   29 |    3 |
|       110 | minha    |   25 |    3 |
|       111 | sunaina  |   29 |    3 |
|       112 | munnavar |   25 |    3 |
+-----------+----------+------+------+
12 rows in set (0.00 sec)

mysql> select count(bookid) freom books;
ERROR 1064 (42000): You have an error in your SQL syntax; check the manual that corresponds to your MySQL server version for the right syntax to use near 'books' at line 1
mysql> select count(bookid) from books;
+---------------+
| count(bookid) |
+---------------+
|             8 |
+---------------+
1 row in set (0.00 sec)

mysql> select * from books;
+--------+---------------------------+----------------+-------+
| bookid | title                     | author         | price |
+--------+---------------------------+----------------+-------+
|      1 | Database Systems          |  Ramez Elmasri |   550 |
|      2 | Operating System Concepts | Silberschatz   |   770 |
|      4 | Algorithms                |  Cormen        |   110 |
|      5 | wings of fire             | apj            |   700 |
|      6 | diary of young girl       | ann            |   600 |
|      7 | discovery of india        | nehru          |   700 |
|      8 | oru deshathinte kadha     | s.k.pottakad   |  1000 |
|      9 | alchemist                 | paulo          |  1200 |
+--------+---------------------------+----------------+-------+
8 rows in set (0.00 sec)

mysql> selct avg(price) from books;
ERROR 1064 (42000): You have an error in your SQL syntax; check the manual that corresponds to your MySQL server version for the right syntax to use near 'selct avg(price) from books' at line 1
mysql> select avg(price) from books;
+------------+
| avg(price) |
+------------+
|   703.7500 |
+------------+
1 row in set (0.00 sec)

mysql> select min(price),max(price) from books;
+------------+------------+
| min(price) | max(price) |
+------------+------------+
|        110 |       1200 |
+------------+------------+
1 row in set (0.00 sec)

mysql> select count(bookid) from bookissues;
+---------------+
| count(bookid) |
+---------------+
|             9 |
+---------------+
1 row in set (0.00 sec)

mysql> select * from booksissues;
ERROR 1146 (42S02): Table '24mca22.booksissues' doesn't exist
mysql> select * from bookissues;
+--------+-----------+------------+-------------+--------+
| bookid | studentid | issue_date | return_date | fine   |
+--------+-----------+------------+-------------+--------+
|      1 |       101 | 2025-08-02 | 2025-08-08  |   0.00 |
|      2 |       102 | 2025-09-03 | 2025-09-04  |   0.00 |
|      4 |       104 | 2025-10-03 | 2025-10-25  |   0.00 |
|      4 |       105 | 2025-11-08 | 2025-12-12  |   0.00 |
|      5 |       106 | 2025-01-07 | 2025-01-09  |   0.00 |
|      6 |       110 | 2025-02-03 | 2025-09-26  |   0.00 |
|      7 |       107 | 2025-01-25 | NULL        | 100.00 |
|      7 |       109 | 2025-04-05 | 2025-04-06  |   0.00 |
|      8 |       107 | 2025-05-05 | 2025-04-22  |   0.00 |
+--------+-----------+------------+-------------+--------+
9 rows in set (0.00 sec)

mysql> select count(*) from bookissues group by studentid;
+----------+
| count(*) |
+----------+
|        1 |
|        1 |
|        1 |
|        1 |
|        1 |
|        1 |
|        2 |
|        1 |
+----------+
8 rows in set (0.00 sec)

mysql> select count(bookid) from bookissues group by studentid;
+---------------+
| count(bookid) |
+---------------+
|             1 |
|             1 |
|             1 |
|             1 |
|             1 |
|             1 |
|             2 |
|             1 |
+---------------+
8 rows in set (0.00 sec)

mysql> select studentid,count(bookid) from bookissues group by studentid;
+-----------+---------------+
| studentid | count(bookid) |
+-----------+---------------+
|       101 |             1 |
|       102 |             1 |
|       104 |             1 |
|       105 |             1 |
|       106 |             1 |
|       110 |             1 |
|       107 |             2 |
|       109 |             1 |
+-----------+---------------+
8 rows in set (0.00 sec)

mysql> select count(bookid) from bookissues ;
+---------------+
| count(bookid) |
+---------------+
|             9 |
+---------------+
1 row in set (0.00 sec)

mysql> select count(distinct bookid) from bookissues ;
+------------------------+
| count(distinct bookid) |
+------------------------+
|                      7 |
+------------------------+
1 row in set (0.00 sec)

mysql> select * from books;
+--------+---------------------------+----------------+-------+
| bookid | title                     | author         | price |
+--------+---------------------------+----------------+-------+
|      1 | Database Systems          |  Ramez Elmasri |   550 |
|      2 | Operating System Concepts | Silberschatz   |   770 |
|      4 | Algorithms                |  Cormen        |   110 |
|      5 | wings of fire             | apj            |   700 |
|      6 | diary of young girl       | ann            |   600 |
|      7 | discovery of india        | nehru          |   700 |
|      8 | oru deshathinte kadha     | s.k.pottakad   |  1000 |
|      9 | alchemist                 | paulo          |  1200 |
+--------+---------------------------+----------------+-------+
8 rows in set (0.00 sec)

mysql> select title,max(price) from books;
ERROR 1140 (42000): In aggregated query without GROUP BY, expression #1 of SELECT list contains nonaggregated column '24mca22.books.title'; this is incompatible with sql_mode=only_full_group_by
mysql> select books.title,max(price) from books;
ERROR 1140 (42000): In aggregated query without GROUP BY, expression #1 of SELECT list contains nonaggregated column '24mca22.books.title'; this is incompatible with sql_mode=only_full_group_by
mysql> select max(price) from books;
+------------+
| max(price) |
+------------+
|       1200 |
+------------+
1 row in set (0.00 sec)

mysql> select title,max(price) from books;
ERROR 1140 (42000): In aggregated query without GROUP BY, expression #1 of SELECT list contains nonaggregated column '24mca22.books.title'; this is incompatible with sql_mode=only_full_group_by
